B0B65D9YBS,"1,099","https://images-na.ssl-images-amazon.com/images/G/01/x-locale/common/grey-pixel.gif,https://m.media-amazon.com/images/S/aplus-media-library-service-media/9eb976cc-496c-4b7a-9844-13fba25bbc4b.__CR0,0,1500,1500_PT0_SX300_V1___.jpg,https://images-na.ssl-images-amazon.com/images/G/01/x-locale/common/grey-pixel.gif,https://m.media-amazon.com/images/S/aplus-media-library-service-media/7237d4ab-16a1-480b-a3d2-707b96679640.__CR0,0,970,600_PT0_SX970_V1___.jpg,https://images-na.ssl-images-amazon.com/images/G/01/x-locale/common/grey-pixel.gif,https://m.media-amazon.com/images/S/aplus-media/vc/9776e39d-bcb5-435b-9a1c-0802e2f9db33.__CR0,0,1200,1600_PT0_SX300_V1___.jpg,https://images-na.ssl-images-amazon.com/images/G/01/x-locale/common/grey-pixel.gif,https://m.media-amazon.com/images/S/aplus-media/vc/91057747-16cc-4ea4-b783-7f4806383912.__CR0,0,1200,600_PT0_SX350_V1___.jpg,https://images-na.ssl-images-amazon.com/images/G/01/x-locale/common/grey-pixel.gif,https://m.media-amazon.com/images/S/aplus-media-library-service-media/3df02bc6-94d9-46bc-bede-c12849c8fcbe.__CR0,0,300,300_PT0_SX300_V1___.jpg,https://images-na.ssl-images-amazon.com/images/G/01/x-locale/common/grey-pixel.gif,https://m.media-amazon.com/images/S/aplus-media/vc/7538a575-d19f-4f9b-81b0-ebfa6c98bddc.__CR0,0,1200,1200_PT0_SX300_V1___.jpg,https://images-na.ssl-images-amazon.com/images/G/01/x-locale/common/grey-pixel.gif,https://m.media-amazon.com/images/S/aplus-media/vc/851f7ca4-3eea-4f0d-8c0d-8a9fb8f25f5b.__CR0,0,1200,1200_PT0_SX300_V1___.jpg,https://m.media-amazon.com/images/S/aplus-media/vc/c002e37b-3e8e-4590-bea4-c2a2c4dbfa19.__CR0,0,600,1200_PT0_SX150_V1___.jpg,https://m.media-amazon.com/images/S/aplus-media/vc/c42bc52b-d9a4-4938-afd3-11c4dde16629.__CR0,0,600,1200_PT0_SX150_V1___.jpg,https://m.media-amazon.com/images/S/aplus-media/vc/2dbce7d1-d704-4aa4-b672-e0b8f729e2ad.__CR0,0,600,1200_PT0_SX150_V1___.jpg,https://m.media-amazon.com/images/S/aplus-media/vc/d15a9d46-9bd7-4228-b5dc-fc97f44a2c10.__CR0,0,600,1200_PT0_SX150_V1___.jpg,https://m.media-amazon.com/images/S/aplus-media/vc/57c9ef50-0582-4418-bb43-78514490fd7d.__CR0,0,600,1200_PT0_SX150_V1___.jpg,https://m.media-amazon.com/images/S/aplus-media/vc/e292b833-ea3d-4482-b432-eb59b6320e5f.__CR0,0,600,1200_PT0_SX150_V1___.jpg","STRAUSS helps you develop a holistic approach towards a healthy, balanced mind and body.At STRAUSS we believe fitness is a passion and confidence builder. Expressing passion through fitness is a great way to feel alive and engaged in the world - truly the best simple pleasureSimply Adjust, Strap In, and Go! It's as simple as that. Featuring innovative wheel technology, It has two parallel arranged wheels give it pairs that you more stability, on your slow ride as well as when standing.Revolutionize your favorite pair of shoes instantly with the Strauss Roller Skates. Strauss Roller Skates marks a new beginning for roller skating. No longer are you confined to traditional roller skates, you can personalize your own look, so your Strauss Roller Skates can match each unique personality/mood with its easily transferable clip-on nature. The Tenacity Roller Skates show is a sleek and classic design, Comfy, stylish and easy to use, children and seniors can skate for hours!These quad roller skates are man-made using a Mild steel material and zinc plated/Powder Coated that creates a breathable, yet durable skate with a Powerful Steel Plate.These adjustable roller skates have an easy lace system and a Velcro cinch strap that makes adjusting the skates simple.These quad skate’s wheels have 55 mm with brake, hardness Rubber wheels designed to provide just the right amount of grip.",NA,NA,NA," HIGH-QUALITY ULTRA DURABLE ROLLER SKATES - These quad roller skates are man-made using a Mild steel material and zinc plated/Powder Coated that creates a breathable, yet durable skate with a Powerful steel Plate.  
, EASY TO LACE & COMFORTABLE FIT - These adjustable roller skates have an easy lace system and a Velcro strap that makes adjusting the skates simple  
, SMOOTHEST RIDE POSSIBLE - These fun colored skates feature Precision ball bearings designed to provide a smooth roll. These quad skates wheels have 50 mm, hardness Rubber wheels designed to provide just the right amount of grip. These roller skates are perfect for boys, and girls.  
, DESIGNED WITH SAFETY IN MIND - These traditional roller shoes are designed with safety in mind. The skates has a low, yet snug fit around the ankle and the Velcro strap helps secure the foot in the skate while skating  
, SUITABLE - for age Group 6-8 years.  
",NA,NA,NA,NA,NA,36%,"https://m.media-amazon.com/images/I/51oGDVPg3jL.jpg,https://m.media-amazon.com/images/I/91Xxf8cNXhL.png,https://m.media-amazon.com/images/I/51JfdHqImVL.jpg,https://m.media-amazon.com/images/I/514Nxpo088L.jpg,https://m.media-amazon.com/images/I/51qUbl3h2YL.jpg,https://m.media-amazon.com/images/I/51YL5sdaIeL.jpg,https://m.media-amazon.com/images/I/51odkwan2WL.jpg",NA,NA,NA,NA,NA,NA,NA,NA,NA,NA,NA,NA,NA,"Avail No Cost EMI on select cards for orders above ₹3000,Upto ₹52.42 discount on select Credit Cards,Get GST  invoice and save up to 28% on business purchases.",NA,NA,699,"Toys & Games,Bikes, Trikes & Ride-Ons,Rollerskates",3.7,438 global ratings,NA,NA,"Strauss Baby Tenacity Roller Skates, (Black)"," No Cost EMI , Bank Offer , Partner Offers ",https://www.amazon.in/Strauss-Adjustable-Roller-Suitable-Multicolor/dp/B0B65D9YBS,NA,NA,NA,1,0,1,[[]],0,1,1,0,1,[[]],0,1,1,1,0,"[[], [], [{'start': 148, 'text': '50 mm', 'correct': 'a 50 mm', 'definition': None}, {'start': 129, 'text': 'skates', 'correct': 'skate', 'definition': None}], [{'start': 107, 'text': 'has', 'correct': 'have', 'definition': None}], []]",0,C,0,0,0,C
B0BBVZXN6Y,"1,299","https://images-na.ssl-images-amazon.com/images/G/01/x-locale/common/grey-pixel.gif,https://m.media-amazon.com/images/S/aplus-media-library-service-media/9eb976cc-496c-4b7a-9844-13fba25bbc4b.__CR0,0,1500,1500_PT0_SX300_V1___.jpg,https://images-na.ssl-images-amazon.com/images/G/01/x-locale/common/grey-pixel.gif,https://m.media-amazon.com/images/S/aplus-media-library-service-media/fe4a0b4b-d6dc-42dc-be81-ed54949c8223.__CR0,0,970,600_PT0_SX970_V1___.jpg,https://images-na.ssl-images-amazon.com/images/G/01/x-locale/common/grey-pixel.gif,https://m.media-amazon.com/images/S/aplus-media-library-service-media/634e1c93-e339-4d10-bc38-9665436cad76.__CR0,0,970,600_PT0_SX970_V1___.jpg,https://images-na.ssl-images-amazon.com/images/G/01/x-locale/common/grey-pixel.gif,https://m.media-amazon.com/images/S/aplus-media-library-service-media/b1627bb2-8b2a-4af6-acad-d1fb0a13639c.__CR0,0,2000,2000_PT0_SX300_V1___.jpg,https://images-na.ssl-images-amazon.com/images/G/01/x-locale/common/grey-pixel.gif,https://m.media-amazon.com/images/S/aplus-media-library-service-media/6c2737ec-e9cb-4e39-b60f-b3bd09d2a64c.__CR0,0,2000,2000_PT0_SX300_V1___.jpg,https://images-na.ssl-images-amazon.com/images/G/01/x-locale/common/grey-pixel.gif,https://m.media-amazon.com/images/S/aplus-media-library-service-media/3870fbb8-8618-4c9a-bec3-607d5918390d.__CR0,0,2000,2000_PT0_SX300_V1___.jpg,https://images-na.ssl-images-amazon.com/images/G/01/x-locale/common/grey-pixel.gif,https://m.media-amazon.com/images/S/aplus-media-library-service-media/8851a66c-5e2d-4a74-a819-209a95fb5226.__CR0,0,970,300_PT0_SX970_V1___.jpg","STRAUSS helps you develop a holistic approach towards a healthy, balanced mind and body.At STRAUSS we believe fitness is a passion and confidence builder. Expressing passion through fitness is a great way to feel alive and engaged in the world - truly the best simple pleasure.The High Tensile Slim Shaft incorporates unique elastic material which effectively balances the rebound and anti-torsion performance to enhance the transmission of power.The oval frame design expands the sweet spot. Increases the effectiveness of the string lines and the hit rate. Enhance the defense and increase the effective range. More longevity than other competitors badminton racket.The Superlight technology incorporated in the racket makes it very lightweight so you can nimble on the court without sacrificing power or anything.",NA,NA,NA," High Tensile Slim Shaft - The High Tensile Slim Shaft incorporates unique elastic material which effectively balances the rebound and anti-torsion performance to enhance the transmission of power.  
, Superlight technology - The Superlight technology incorporated in the racket makes it very lightweight so you can nimble on the court without sacrificing power or anything.  
, The Aluminum badminton racquet is made of Graphite, racket weight unstrung 78 grams, it is light. You can enjoy the badminton game longer and do not have shoulder pain caused by other heavier racket.  
, You will enjoy the performance of these rackets’ light weight and tight stringing  
, Ideal for beginners and intermediate level players  
",NA,NA,NA,NA,NA,42%,"https://m.media-amazon.com/images/I/51QvvP59w4L.jpg,https://m.media-amazon.com/images/I/51IOCAwX4FL.jpg,https://m.media-amazon.com/images/I/51d6EWpzB9L.jpg,https://m.media-amazon.com/images/I/51SpOQP7IjL.jpg,https://m.media-amazon.com/images/I/51+NXe2NSEL.jpg,https://m.media-amazon.com/images/I/51tX3JxTsPL.jpg,https://m.media-amazon.com/images/I/51kul7ZpWGL.jpg",NA,NA,NA,NA,NA,NA,NA,NA,NA,NA,NA,NA,NA,"Avail No Cost EMI on select cards for orders above ₹3000,Upto ₹56.92 discount on select Credit Cards,Get GST  invoice and save up to 28% on business purchases.",NA,NA,759,"Sports, Fitness & Outdoors,Badminton,Racquets",3.9,16 global ratings,NA,NA,"Strauss Aluminium Badminton Racket with 3 Pieces Nylon Shuttles with Full-Cover Set , (Multicolor)"," No Cost EMI , Bank Offer , Partner Offers ",https://www.amazon.in/Aluminium-Badminton-Shuttles-Full-Cover-Multicolor/dp/B0BBVZXN6Y,NA,NA,NA,0,1,0,"[[{'start': 83, 'text': ' ,', 'correct': ',', 'definition': 'Accept space'}]]",0,1,1,0,1,[[]],0,1,1,1,0,"[[], [{'start': 114, 'text': 'nimble', 'correct': 'nimbly', 'definition': None}], [], [], []]",0,C,0,0,1,C
B09V6XKC6P,"2,199","https://images-na.ssl-images-amazon.com/images/G/01/x-locale/common/grey-pixel.gif,https://m.media-amazon.com/images/S/aplus-media/vc/f48b97ce-4196-4b78-8b71-cc588826c3ea._CR110,0,1440,1440_PT0_SX300__.png,https://images-na.ssl-images-amazon.com/images/G/01/x-locale/common/grey-pixel.gif,https://m.media-amazon.com/images/S/aplus-media-library-service-media/8ff5464d-b9d0-4771-803f-0a0492103a26.__CR0,0,970,300_PT0_SX970_V1___.jpg,https://images-na.ssl-images-amazon.com/images/G/01/x-locale/common/grey-pixel.gif,https://m.media-amazon.com/images/S/aplus-media-library-service-media/af527e9a-da39-4da5-b97d-37b1737d73f1.__CR0,0,300,400_PT0_SX300_V1___.jpg,https://images-na.ssl-images-amazon.com/images/G/01/x-locale/common/grey-pixel.gif,https://m.media-amazon.com/images/S/aplus-media-library-service-media/1ca4bb36-6f5b-4d49-a524-c3f0f208f985.__CR0,500,2000,1000_PT0_SX350_V1___.jpg,https://images-na.ssl-images-amazon.com/images/G/01/x-locale/common/grey-pixel.gif,https://m.media-amazon.com/images/S/aplus-media-library-service-media/2ca75604-4a42-4ef0-a8ea-6f6079544a3a.__CR0,0,220,220_PT0_SX220_V1___.jpg,https://images-na.ssl-images-amazon.com/images/G/01/x-locale/common/grey-pixel.gif,https://m.media-amazon.com/images/S/aplus-media-library-service-media/758595b9-014a-4dc3-bcfd-d0b84c13483b.__CR0,0,220,220_PT0_SX220_V1___.jpg,https://images-na.ssl-images-amazon.com/images/G/01/x-locale/common/grey-pixel.gif,https://m.media-amazon.com/images/S/aplus-media-library-service-media/7f0dd3ec-9342-44ab-9839-6cf48b9f8614.__CR0,0,220,220_PT0_SX220_V1___.jpg,https://images-na.ssl-images-amazon.com/images/G/01/x-locale/common/grey-pixel.gif,https://m.media-amazon.com/images/S/aplus-media-library-service-media/114d4ce0-bf1c-4823-a5e7-56bf0949bc63.__CR0,0,220,220_PT0_SX220_V1___.jpg,https://m.media-amazon.com/images/S/aplus-media/vc/7c81e80a-eb33-4721-9e3d-48d11f96ea9e.__CR0,0,1000,2000_PT0_SX150_V1___.jpg,https://m.media-amazon.com/images/S/aplus-media/vc/a3993f74-1c8f-45ef-a26e-8833948a3a56.__CR0,0,1000,2000_PT0_SX150_V1___.jpg,https://m.media-amazon.com/images/S/aplus-media/vc/ddb82fda-4bf5-4c59-a337-9ebd4bd889a9.__CR0,0,1000,2000_PT0_SX150_V1___.jpg,https://m.media-amazon.com/images/S/aplus-media/vc/73f3db8b-29ff-4fb3-999e-bb3109e7b7be.__CR0,0,1000,2000_PT0_SX150_V1___.jpg,https://m.media-amazon.com/images/S/aplus-media/vc/131ae775-cb43-44cf-a5fd-c15f7de7ccd7.__CR0,0,1000,2000_PT0_SX150_V1___.jpg,https://m.media-amazon.com/images/S/aplus-media/vc/bc059c4a-3232-4830-886f-98c9c14e042d.__CR0,0,1000,2000_PT0_SX150_V1___.jpg","STRAUSS  helps you develop a holistic approach towards a healthy, balanced mind and body.At STRAUSS we believe fitness is a passion and confidence  builder. Expressing passion through fitness is a great way to feel alive   and engaged in the world - truly the best simple pleasure.The skateboard is suitable for any level of riders to enjoy outdoor entertainment time, no matter whether you’re a beginner or experienced rider. This Cruiser skateboard performs excellent flexibility and is resistant to distortion. It’s really wonderful birthday or holiday gift.Cruiser Skateboard is suitable for all skill levels from  beginners to professionals. It's a combination of exercise and  fun. We have a variety of colors and amazing patterns for boys and girls. For adults it seems to have broken down the boundaries of what skateboarding was and opened another way to have fun on a skateboard again.The skateboard is a type of sports equipment used primarily for the activity of skateboarding. Strauss brings you a quality skateboard. The Cruiser skateboard offers quality components paired with some great quality eye-catching graphics. No average product, fitted with best inline carbon ball-bearings for a smooth and uninterrupted skateboarding. Skateboard is the perfect size to travel with or for a short commute to school or work. Easily store in a backpack when not in  use.All Strauss Skateboards come fully assembled and ready to ride. Round up the crew, pick your spot and get rolling!With all the highest quality components, you won't believe how smooth the Strauss ride is. With our signature Strauss ABEC 7 bearings on each board, you'll go smooth and fast!Strauss Skateboards can come everywhere with you! They're small, light & can fit in most backpacks. Perfect for the college campus, or your next vacation!Strauss has the biggest collection of colors and styles! Shop the full collection and get your perfect Strauss board set up today.",NA,NA,NA," QUIP CRUISER: It's smooth sailing with Quip’s small kicktail and molded waffle pattern for a solid hold on every twist, turn, and last-minute dodge you encounter. Our newest edition comes with 5"" trucks for more control, balance, and enhanced maneuverability. All that nerve and more can fit right inside your backpack.  
, SMALL, BUT MIGHTY: Cruise confidently knowing that your board is constructed from 22"" x 6"" injection-molded highly flexible plastic. Engineered to fit with how you move, not define it. Featuring soft wheels perfect for soaking up all those street bumps and sidewalk cracks all while giving you the smooth ride you expect from Strauss.  
, FASTER THAN EVER: The ultra-smooth gliding polyurethane cast wheels enhance durability and comfort while you zip around town. Lightweight ABEC-7 high-speed carbon bearings add to Quip's nimble nature. It's wheel emits light while skateboarding.  
, LIGHTWEIGHT & PORTABLE: Quip can fit anywhere. Literally. Light Weight and you can toss it in your backpack, trunk, locker, or closet without missing a beat. Recommended Max Weight Limit: 70 Kg.  
",NA,NA,NA,NA,NA,35%,"https://m.media-amazon.com/images/I/41JttmVFF1L.jpg,https://m.media-amazon.com/images/I/51LrUTaVbwL.jpg,https://m.media-amazon.com/images/I/51Nl9XKHLSL.jpg,https://m.media-amazon.com/images/I/51DU8nHGt5L.jpg,https://m.media-amazon.com/images/I/51rjb29IkxL.jpg,https://m.media-amazon.com/images/I/51xYlYsZyAL.jpg,https://m.media-amazon.com/images/I/41YgafEGh7L.jpg",NA,NA,NA,NA,NA,NA,NA,NA,NA,NA,NA,NA,NA,"Avail No Cost EMI on select cards for orders above ₹3000,Upto ₹107.62 discount on select Credit Cards,Get GST  invoice and save up to 28% on business purchases.",NA,NA,"1,435","Toys & Games,Games,Board Games",4.0,559 global ratings,NA,NA,"Strauss Cruiser Penny Board with LED Wheels, (Blue)"," No Cost EMI , Bank Offer , Partner Offers ",https://www.amazon.in/Strauss-Cruiser-Penny-Board-Wheels/dp/B09V6XKC6P,NA,NA,NA,0,1,1,[[]],0,1,1,0,1,[[]],0,0,1,1,0,"[[{'start': 52, 'text': 'kicktail', 'correct': 'cocktail', 'definition': 'a short mixed drink'}], [], [], [], [], [], [], [], [], []]",0,C,0,0,1,C
