B0B4P583DH,699,"https://images-na.ssl-images-amazon.com/images/G/01/x-locale/common/grey-pixel.gif,https://m.media-amazon.com/images/S/aplus-media-library-service-media/7625b705-bc8e-4bb6-9483-e0feba3b0aea.__CR0,0,1500,1500_PT0_SX300_V1___.jpg,https://images-na.ssl-images-amazon.com/images/G/01/x-locale/common/grey-pixel.gif,https://m.media-amazon.com/images/S/aplus-media/vc/452b2782-3e4d-4e5f-8ae8-cb98109e9992.__CR0,0,970,300_PT0_SX970_V1___.jpg,https://images-na.ssl-images-amazon.com/images/G/01/x-locale/common/grey-pixel.gif,https://m.media-amazon.com/images/S/aplus-media/vc/a5800962-fc36-4492-9a68-b93947421030.__CR0,0,1200,1600_PT0_SX300_V1___.jpg,https://images-na.ssl-images-amazon.com/images/G/01/x-locale/common/grey-pixel.gif,https://m.media-amazon.com/images/S/aplus-media/vc/64de1399-18b3-48da-9b6b-4dc5d19ccf3b.__CR0,0,1200,600_PT0_SX350_V1___.jpg,https://images-na.ssl-images-amazon.com/images/G/01/x-locale/common/grey-pixel.gif,https://m.media-amazon.com/images/S/aplus-media/vc/78ea871f-e744-4c43-8dce-6a3890dbcd7f.__CR0,0,800,800_PT0_SX300_V1___.jpg,https://images-na.ssl-images-amazon.com/images/G/01/x-locale/common/grey-pixel.gif,https://m.media-amazon.com/images/S/aplus-media/vc/2555e5db-cac4-4aec-ade3-1d307f0d2d4b.__CR0,0,800,800_PT0_SX300_V1___.jpg,https://images-na.ssl-images-amazon.com/images/G/01/x-locale/common/grey-pixel.gif,https://m.media-amazon.com/images/S/aplus-media/vc/ed6592db-d78f-497b-bd00-9a88f44f6060.__CR0,0,800,800_PT0_SX300_V1___.jpg","Strauss helps you develop a holistic approach towards a healthy, balanced mind and body.At Strauss we believe fitness is a passion and confidence builder. Expressing passion through fitness is a great way to feel alive and engaged in the world - truly the good and simple pleasure.Push Up Bars made of high-quality polypropylene, they are sturdy and strong enough to support any weight, ensure you a safe and great sports experience. The sweat-absorbing soft foam cushion is designed for a non-slip and comfortable grip and the bracket features an H-shaped reinforced structure, which has strong stability and avoids shaking caused by uneven stressKeep perfect form while doing your push ups with this non-skid push up bar. The anti-slip feet will keep the push up, stand right where it belongs without sliding. Higher clearance allows you to get a deeper range of motion while performing exercises. When you work up a sweat these non slip grips allow for a safer and more comfortable workout. Legs are assembled with easy turn key screws. Just lock the legs in place and you are ready to go.Push Up Bars made of polypropylene, this high-quality material are very sturdy and strong enough to support any weight.It weighs only 1.10 lbs (500g) for each push-up stand. They are perfect for push-ups at home, gym, office, or travel, suitable for indoor and outdoor use. Lightweight and easy to disassemble, they fit in every luggage!The sweat-absorbing soft foam cushion is designed for a non-slip and comfortable grip, which ensures you a safe and great sports experience.",NA,NA,NA," TILT DESIGN : We used tilt design in our push up bar for men and women which will reduce pressure from your wrist so you can do more counts of push ups at one time.  
, COMFORTABLE HANDLES: Our push up bars have a cushioned foam grip, which helps to reduce strain on your wrists, helping you perform more effective pushups without wrist pain.  
, STURDY AND NON-SKID: The Non-Skid Base prevents you from moving or collapsing while doing exercises. These high-quality and well-built push up bars will provide you with a fat-burning, strength workout.  
, UPPER BODY EXERCISE: Using the push up bars can train your chest, shoulders, triceps and back muscles; it is suitable for man or woman to do pushup workout or muscle enhancement.  
, PORTABLE: It can be easily assembled and disassembled. This makes it convenient to take them to gym, office, or travel. Stick them in your bag and you're all set  
",NA,NA,NA,NA,NA,50%,"https://m.media-amazon.com/images/I/41Qu8vY43GL.jpg,https://m.media-amazon.com/images/I/81fufr8w0LL.png,https://m.media-amazon.com/images/I/41tVI+KrEBL.jpg,https://m.media-amazon.com/images/I/51o679DKquL.jpg,https://m.media-amazon.com/images/I/410eHOpw7CL.jpg,https://m.media-amazon.com/images/I/41jZ0-uSIEL.jpg,https://m.media-amazon.com/images/I/411s1CRDzqL.jpg",NA,NA,NA,NA,NA,NA,NA,NA,NA,NA,NA,NA,NA,"Avail No Cost EMI on select cards for orders above ₹3000,Upto ₹26.17 discount on select Credit Cards,Get GST  invoice and save up to 28% on business purchases.",NA,NA,349,"Sports, Fitness & Outdoors,Exercise & Fitness,Strength Training Equipment,Dip Stands",3.7,"1,664 global ratings",NA,NA,"Strauss Moto Push Up Bar, Pair (Black/Blue)"," No Cost EMI , Bank Offer , Partner Offers ",https://www.amazon.in/Strauss-Moto-Push-Pair-Black/dp/B0B4P583DH,NA,NA,NA,0,1,1,[[]],0,1,1,0,1,[[]],0,0,1,1,0,"[[{'start': 65, 'text': 'women which', 'correct': 'women, which', 'definition': 'Accept comma addition'}, {'start': 11, 'text': ' :', 'correct': ':', 'definition': 'Accept space'}], [{'start': 131, 'text': 'more effective', 'correct': 'more effectively', 'definition': None}], [], [], [{'start': 96, 'text': 'gym', 'correct': 'the gym', 'definition': None}]]",0,C,0,0,1,C
B0B3DX3TD9,749,"https://images-na.ssl-images-amazon.com/images/G/01/x-locale/common/grey-pixel.gif,https://m.media-amazon.com/images/S/aplus-media-library-service-media/b59e4c43-ea10-4e2f-8f95-48e062735280.__CR0,0,1464,625_PT0_SX1464_V1___.jpg,https://images-na.ssl-images-amazon.com/images/G/01/x-locale/common/grey-pixel.gif,https://m.media-amazon.com/images/S/aplus-media-library-service-media/ecd6a987-26e4-4704-b60e-37590b5647d6.__CR0,0,315,145_PT0_SX315_V1___.jpg,https://images-na.ssl-images-amazon.com/images/G/01/x-locale/common/grey-pixel.gif,https://m.media-amazon.com/images/I/511EupYVZLL.__AC_SR166,182___.jpg,https://images-na.ssl-images-amazon.com/images/G/01/x-locale/common/grey-pixel.gif,https://m.media-amazon.com/images/I/51tK6O2%2BKVL.__AC_SR166,182___.jpg,https://images-na.ssl-images-amazon.com/images/G/01/x-locale/common/grey-pixel.gif,https://m.media-amazon.com/images/I/41Ei4TqsOxL.__AC_SR166,182___.jpg,https://images-na.ssl-images-amazon.com/images/G/01/x-locale/common/grey-pixel.gif,https://m.media-amazon.com/images/I/41q-QSwcIFL.__AC_SR166,182___.jpg,https://images-na.ssl-images-amazon.com/images/G/01/x-locale/common/grey-pixel.gif,https://m.media-amazon.com/images/I/41hErsR%2BI9L.__AC_SR166,182___.jpg,https://images-na.ssl-images-amazon.com/images/G/01/x-locale/common/grey-pixel.gif,https://m.media-amazon.com/images/I/41UIHmHXeCL.__AC_SR166,182___.jpg,https://images-na.ssl-images-amazon.com/images/G/01/x-locale/common/grey-pixel.gif,https://m.media-amazon.com/images/I/41Bjg6zu4SL.__AC_SR166,182___.jpg,https://images-na.ssl-images-amazon.com/images/G/01/x-locale/common/grey-pixel.gif,https://m.media-amazon.com/images/I/31fjaBNQKaL.__AC_SR166,182___.jpg,https://images-na.ssl-images-amazon.com/images/G/01/x-locale/common/grey-pixel.gif,https://m.media-amazon.com/images/S/aplus-media-library-service-media/ba9e72e6-3b0c-40a3-b436-adf815e4ac5d.__CR0,0,362,453_PT0_SX362_V1___.jpg,https://images-na.ssl-images-amazon.com/images/G/01/x-locale/common/grey-pixel.gif,https://m.media-amazon.com/images/S/aplus-media-library-service-media/6d4f4e36-9085-4291-97b4-c304947da1fb.__CR347,159,999,1250_PT0_SX362_V1___.jpg,https://images-na.ssl-images-amazon.com/images/G/01/x-locale/common/grey-pixel.gif,https://m.media-amazon.com/images/S/aplus-media-library-service-media/7625b705-bc8e-4bb6-9483-e0feba3b0aea.__CR0,0,1500,1500_PT0_SX300_V1___.jpg,https://images-na.ssl-images-amazon.com/images/G/01/x-locale/common/grey-pixel.gif,https://m.media-amazon.com/images/S/aplus-media-library-service-media/c168b924-9ade-412e-9598-c526db0414cd.__CR0,0,970,600_PT0_SX970_V1___.jpg,https://images-na.ssl-images-amazon.com/images/G/01/x-locale/common/grey-pixel.gif,https://m.media-amazon.com/images/S/aplus-media-library-service-media/bf5da8dd-d75c-4dbc-930a-a37df862ad55.__CR0,0,970,600_PT0_SX970_V1___.jpg,https://images-na.ssl-images-amazon.com/images/G/01/x-locale/common/grey-pixel.gif,https://m.media-amazon.com/images/S/aplus-media-library-service-media/981c6565-47f0-4e83-860b-cc5d80059375.__CR0,0,300,300_PT0_SX300_V1___.jpg,https://images-na.ssl-images-amazon.com/images/G/01/x-locale/common/grey-pixel.gif,https://m.media-amazon.com/images/S/aplus-media-library-service-media/79b1abbf-544b-4aa3-bff4-61090129b395.__CR0,0,300,300_PT0_SX300_V1___.jpg,https://images-na.ssl-images-amazon.com/images/G/01/x-locale/common/grey-pixel.gif,https://m.media-amazon.com/images/S/aplus-media-library-service-media/1515312d-e471-4234-aff4-37c63e909db0.__CR0,0,300,300_PT0_SX300_V1___.jpg,https://images-na.ssl-images-amazon.com/images/G/01/x-locale/common/grey-pixel.gif,https://m.media-amazon.com/images/S/aplus-media-library-service-media/c5f10968-0a34-476a-9f4f-27baf2910b8b.__CR0,0,970,600_PT0_SX970_V1___.jpg","IMPROVED FINGER STRENGTHCOMPACT AND DURABLESUITABLE FOR MEN AND WOMENINCREASES FLEXIBILITYIDEAL FOR BODY WOROUTHIGH QUALITY & DURABLESTRAUSS helps you develop a holistic approach towards a healthy, balanced mind and body.At STRAUSS we believe fitness is a passion and confidence builder. Expressing passion through fitness is a great way to feel alive and engaged in the world - truly the best simple pleasure.Made from premium quality natural latex for maximum strength and resistance.Cushioned foam handles provide comfortable and slip-free grip.Strauss exercise resistance ropes are made from premium quality for continued comfort during repetitive movements",NA,NA,NA," RESISTANCE BAND: Designed for light and speedy mobility, the exercise band can be rolled up to stash in a gym bag, suitcase, or overnight trip making it perfect for travel, gym, or in home use.  
, TUFF DURABLE RUBBER: This heavy duty, high quality material has greater resistance to abrasion and tears to stand up to the rigorous demands of professional use.  
, PREMIUM COMFORT: Workout Bands with Comfort Handles for continued comfort during repetitive movements. This translates into easier Resistance Band Training for both Men and Women.  
, GREAT FOR ALL TYPE OF FITNESS: Helps you isolate target muscles more effectively and is perfect for use in group training and strength conditioning classes, Pilates and physical therapy and rehabilitation  
, HIGH QUALITY PERFORMANCE: Built to a professional grade quality and designed for commercial gyms and clubs to be used 100 times a day versus 100 times a year in a home gym  
",NA,NA,NA,NA,NA,53%,"https://m.media-amazon.com/images/I/41ddqSuwpNL.jpg,https://m.media-amazon.com/images/I/51BtFONAu6L.jpg,https://m.media-amazon.com/images/I/41qEelJEJYL.jpg,https://m.media-amazon.com/images/I/513N2AxuDkL.jpg,https://m.media-amazon.com/images/I/511MBfQuqSL.jpg,https://m.media-amazon.com/images/I/51K0i5xVeuL.jpg,https://m.media-amazon.com/images/I/51wFPN13NRL.jpg",NA,NA,NA,NA,NA,NA,NA,NA,NA,NA,NA,NA,NA,"Avail No Cost EMI on select cards for orders above ₹3000,Upto ₹26.46 discount on select Credit Cards,Get GST  invoice and save up to 28% on business purchases.",NA,NA,352,"Sports, Fitness & Outdoors,Exercise & Fitness,Accessories,Toning Belts",3.6,"1,624 global ratings",NA,NA,"Strauss Toning Tube, (Blue)"," No Cost EMI , Bank Offer , Partner Offers ",https://www.amazon.in/Strauss-Resistance-Exercise-Workout-Multicolor/dp/B0B3DX3TD9,NA,NA,NA,0,1,1,[[]],0,1,1,0,1,[[]],0,1,1,1,0,"[[], [], [], [], [{'start': 5, 'text': 'QUALITY PERFORMANCE', 'correct': 'QUALITY, PERFORMANCE', 'definition': 'Accept comma addition'}]]",0,C,0,0,1,C
B09JLQKYWY,649,"https://images-na.ssl-images-amazon.com/images/G/01/x-locale/common/grey-pixel.gif,https://m.media-amazon.com/images/S/aplus-media-library-service-media/99235816-e91c-4c1f-8b44-78059ee781fe.__CR0,0,1464,625_PT0_SX1464_V1___.jpg,https://images-na.ssl-images-amazon.com/images/G/01/x-locale/common/grey-pixel.gif,https://m.media-amazon.com/images/S/aplus-media-library-service-media/ecd6a987-26e4-4704-b60e-37590b5647d6.__CR0,0,315,145_PT0_SX315_V1___.jpg,https://images-na.ssl-images-amazon.com/images/G/01/x-locale/common/grey-pixel.gif,https://m.media-amazon.com/images/I/41sj7SOwmrL.__AC_SR166,182___.jpg,https://images-na.ssl-images-amazon.com/images/G/01/x-locale/common/grey-pixel.gif,https://m.media-amazon.com/images/I/51DmgGQ0xHL.__AC_SR166,182___.jpg,https://images-na.ssl-images-amazon.com/images/G/01/x-locale/common/grey-pixel.gif,https://m.media-amazon.com/images/I/51Pot0IECsL.__AC_SR166,182___.jpg,https://images-na.ssl-images-amazon.com/images/G/01/x-locale/common/grey-pixel.gif,https://m.media-amazon.com/images/I/518L4tGd6BL.__AC_SR166,182___.jpg,https://images-na.ssl-images-amazon.com/images/G/01/x-locale/common/grey-pixel.gif,https://m.media-amazon.com/images/I/511EupYVZLL.__AC_SR166,182___.jpg,https://images-na.ssl-images-amazon.com/images/G/01/x-locale/common/grey-pixel.gif,https://m.media-amazon.com/images/I/51tK6O2%2BKVL.__AC_SR166,182___.jpg,https://images-na.ssl-images-amazon.com/images/G/01/x-locale/common/grey-pixel.gif,https://m.media-amazon.com/images/I/41w0lhxwIeL.__AC_SR166,182___.jpg,https://images-na.ssl-images-amazon.com/images/G/01/x-locale/common/grey-pixel.gif,https://m.media-amazon.com/images/I/41q-QSwcIFL.__AC_SR166,182___.jpg,https://images-na.ssl-images-amazon.com/images/G/01/x-locale/common/grey-pixel.gif,https://m.media-amazon.com/images/S/aplus-media-library-service-media/ba9e72e6-3b0c-40a3-b436-adf815e4ac5d.__CR0,0,362,453_PT0_SX362_V1___.jpg,https://images-na.ssl-images-amazon.com/images/G/01/x-locale/common/grey-pixel.gif,https://m.media-amazon.com/images/S/aplus-media-library-service-media/6d4f4e36-9085-4291-97b4-c304947da1fb.__CR347,159,999,1250_PT0_SX362_V1___.jpg,https://images-na.ssl-images-amazon.com/images/G/01/x-locale/common/grey-pixel.gif,https://m.media-amazon.com/images/S/aplus-media/vc/11146796-4ea7-4b50-a2d7-baebfe9cfa09._CR129,0,1440,1440_PT0_SX300__.png,https://images-na.ssl-images-amazon.com/images/G/01/x-locale/common/grey-pixel.gif,https://m.media-amazon.com/images/S/aplus-media/vc/bcfa87d8-719e-46f9-89c5-b32ae77edf26.__CR0,0,970,300_PT0_SX970_V1___.jpg,https://images-na.ssl-images-amazon.com/images/G/01/x-locale/common/grey-pixel.gif,https://m.media-amazon.com/images/S/aplus-media/vc/9929fca1-45b6-4a11-ab0e-19da8384e313.__CR0,0,1200,1600_PT0_SX300_V1___.jpg,https://images-na.ssl-images-amazon.com/images/G/01/x-locale/common/grey-pixel.gif,https://m.media-amazon.com/images/S/aplus-media/vc/8f05be78-b81e-4ed6-971c-89d302b56028.__CR0,0,1200,600_PT0_SX350_V1___.jpg,https://images-na.ssl-images-amazon.com/images/G/01/x-locale/common/grey-pixel.gif,https://m.media-amazon.com/images/S/aplus-media/vc/09ca47da-f6cf-496e-a9f9-8972f8764ae8.__CR0,0,1500,1500_PT0_SX300_V1___.jpg,https://images-na.ssl-images-amazon.com/images/G/01/x-locale/common/grey-pixel.gif,https://m.media-amazon.com/images/S/aplus-media/vc/7ca75907-ed12-48a0-aeae-1e9b282a3e12.__CR0,0,500,500_PT0_SX300_V1___.jpg,https://images-na.ssl-images-amazon.com/images/G/01/x-locale/common/grey-pixel.gif,https://m.media-amazon.com/images/S/aplus-media/vc/6384a80e-21de-4852-b8e3-c3e23a22b6b1.__CR0,0,1500,1500_PT0_SX300_V1___.jpg,https://images-na.ssl-images-amazon.com/images/G/01/x-locale/common/grey-pixel.gif,https://m.media-amazon.com/images/S/aplus-media/vc/b758a9e0-9c6f-4be3-a74d-9e6cb246aeb6.__CR0,0,1500,1500_PT0_SX300_V1___.jpg","IMPROVED FINGER STRENGTHCOMPACT AND DURABLESUITABLE FOR MEN AND WOMENINCREASES FLEXIBILITYIDEAL FOR BODY WOROUTHIGH QUALITY & DURABLESTRAUSS helps you develop a holistic approach towards a healthy, balanced mind and body.At STRAUSS we believe fitness is a passion and confidence  builder. Expressing passion through fitness is a great way to feel alive  and engaged in the world – truly the best simple pleasure.Anatomically shaped to prevent injuries and accelerate your recovery. Its heating effect improves circulations and promotes muscular recovery. Great for healing, recovery and rehab.Super comfortable design made with the finest high-quality material makes it so you can wear with confidence knowing this knee support has been designed for both full comfort and support to help eliminate pain.Our sleeves utilize the heat/sweat from your body and allow the fabric to act like an between your skin and the product. It won’t slip or move during your activities.The soft, elastic, knee cap support stabilizer provides compression in a  sleek, short, simple design that fits comfortably to support sprained  knee ligaments. In turn, improving blood circulation while avoiding  itchiness. Knee cap support perfect for knees, leg, athletic  performance. Each comfortably soft knee support is flexible, allowing  for a full range of motion during any activity. Suitable for daily use,  the lightweight, non slip knee sleeves are perfect for general exercise, cross training, weightlifting and more.You will feel the difference immediately. Get fast pain relief with less swelling, soreness, and stiffness. Our Power Support technology improves blood circulation and heats your muscles, getting more oxygen and less lactic acid build up so you can perform better, recover faster, and prevent injury.Some compression sleeves are too hot, too restrictive, or too bulky. Why settle for anything less than the best? Our Premium Comfort design provides a comfortable, snug, ergonomic fit without cutting off your circulation or restricting your motion.With unmatched support and durability, Top quality double stitching and long lasting construction that won't lose compression over time, whether you're running a half marathon, playing your favorite sport, or just getting through your day - without the nagging pain.",NA,NA,NA," Designed for use on both knees  
, Unique material that produces no allergic reaction  
, Well padded with foam  
, Encourages blood circulation  
, Free size  
",NA,China,28 January 2016,NA,"Do you have a penchant for sport - rough sport, whether it’s basketball, running, tennis or any other high intensity activity, the noorva knee support is a wonderful accessory to use. Made from the highest quality cotton and nylon, the 21 cm knee support offers excellent grip and tightness to keep your knees free from injury. The support was designed to offer support as well as increase circulation to the sensitive area of the knee. It is also ideal for use on knees that have experienced a strain, as the gentle compression speeds up the healing process. The durability of the knee support is impeccable, it will endure much use while showing little sign of wear. None of these advantages come at the cost of comfort - it is as comfortable as anything you’ll ever wear.",61%,"https://m.media-amazon.com/images/I/51Pot0IECsL.jpg,https://m.media-amazon.com/images/I/61VfeQde5QL.jpg,https://m.media-amazon.com/images/I/51BtFONAu6L.jpg,https://m.media-amazon.com/images/I/51Bg3YLny2L.jpg,https://m.media-amazon.com/images/I/51brT6+zhOL.jpg,https://m.media-amazon.com/images/I/51yu3Q-FTnL.jpg,https://m.media-amazon.com/images/I/51IgH9TeRWL.jpg",NA,"Dynamic IT Solution Pvt Ltd, C-13, Sector-58, Noida, UP, 201301; 9871301342",No,NA,NA,NA,NA,NA,NA,NA,NA,NA,2 number,NA,NA,"Dynamic IT Solution Pvt Ltd, C-13, Sector-58, Noida, UP, 201301; 9871301342",254,"Health & Personal Care,Home Medical Supplies & Equipment,Braces, Splints & Supports,Knee & Leg Braces",3.9,534 global ratings,7.5% Instant Discount up to INR 1500 on Standard Chartered Bank Credit Card EMI Trxn. Minimum purchase value INR 100007.5% Instant Discount up to INR 1500 on Amex Credit Card EMI Trxn. Minimum purchase value INR 100005%  Instant Discount up to INR 250 on HSBC Cashback Card Credit Card Transactions. Minimum purchase value INR 1000No cost EMI available on select cards. Please check 'EMI options' above for more details.Get GST  invoice and save up to 28% on business purchases.,NA,STRAUSS Knee Cap Support (Pair),NA,https://www.amazon.in/STRAUSS-Strauss-Knee-Cap-Support/dp/B09JLQKYWY,NA,NA,200 g,0,1,1,[[]],0,1,1,1,0,"[[{'start': 131, 'text': 'noorva', 'correct': 'nerve', 'definition': 'any bundle of nerve fibers running to various organs and tissues of the body'}], [], [{'start': 75, 'text': 'to', 'correct': 'in', 'definition': None}], [], [], [], []]",0,1,1,1,0,"[[], [{'start': 0, 'text': 'Unique material', 'correct': 'A unique material', 'definition': None}], [], [], []]",0,C,0,0,1,C
